<?xml version="1.0" encoding="UTF-8"?>
<rates xmlns:xsi="http://www.w3.org/2001/XMLSchema-instance"
    xmlns="http://www.epam.by/rates" xsi:schemaLocation="http://www.epam.by/rates rates.xsd">
    <rate id="a87654321">
        <name>Unlimited2.0</name>
        <operatorName>MTS</operatorName>
        <payroll>15</payroll>
        <callprices>
            <inNetwork>0.1</inNetwork>
            <outNetwork>0.3</outNetwork>
            <landline>0.25</landline>
        </callprices>
        <smsPrice>0.2</smsPrice>
        <parameters>
            <favoriteNumber>+375292971705</favoriteNumber>
            <tariffication>TWELVE</tariffication>
            <connectionFees>5</connectionFees>
        </parameters>
    </rate>
    <rate id="b12345678">
        <name>Econ</name>
        <operatorName>A1</operatorName>
        <payroll>10</payroll>
        <smsPrice>0.1</smsPrice>
        <parameters>
            <favoriteNumber>+375291231251</favoriteNumber>
            <tariffication>SIXTY</tariffication>
            <connectionFees>0</connectionFees>
        </parameters>
    </rate>
</rates>